dimension,nivel,board,move,valid,reason
Comprensión de Reglas,1,"[[1,1,'x'],[1,2,'b'],[1,3,'b'],[2,1,'b'],[2,2,'o'],[2,3,'b'],[3,1,'b'],[3,2,'b'],[3,3,'b']]","['mark',1,1]",0,"La casilla está ocupada por 'x', por lo que el movimiento no es válido según las reglas básicas del juego."
Comprensión de Reglas,2,"[[1,1,'x'],[1,2,'b'],[1,3,'b'],[2,1,'b'],[2,2,'o'],[2,3,'b'],[3,1,'b'],[3,2,'b'],[3,3,'b']]","['mark',1,3]",1,"El movimiento es válido y respeta las reglas básicas, aunque no contempla escenarios más complejos o estrategias."
Comprensión de Reglas,3,"[[1,1,'x'],[1,2,'b'],[1,3,'b'],[2,1,'b'],[2,2,'o'],[2,3,'b'],[3,1,'b'],[3,2,'b'],[3,3,'b']]","['mark',2,2]",1,"Movimiento válido que cumple todas las reglas y además bloquea una amenaza directa del oponente, demostrando comprensión profunda del juego."
Validez y Legalidad,1,"[[1,1,'x'],[1,2,'b'],[1,3,'b'],[2,1,'b'],[2,2,'o'],[2,3,'b'],[3,1,'b'],[3,2,'b'],[3,3,'b']]","['mark',0,2]",0,"El movimiento intenta marcar fuera de los límites del tablero, lo que es ilegal e inválido."
Validez y Legalidad,2,"[[1,1,'x'],[1,2,'b'],[1,3,'b'],[2,1,'b'],[2,2,'o'],[2,3,'b'],[3,1,'b'],[3,2,'b'],[3,3,'b']]","['mark',3,2]",1,"Movimiento dentro de los límites y válido, aunque sin un análisis detallado del estado del juego."
Validez y Legalidad,3,"[[1,1,'x'],[1,2,'b'],[1,3,'b'],[2,1,'b'],[2,2,'o'],[2,3,'b'],[3,1,'b'],[3,2,'b'],[3,3,'b']]","['mark',2,3]",1,"Movimiento legal cuidadosamente elegido después de evaluar todas las posibles jugadas y consecuencias en el tablero."
Razonamiento Estratégico,1,"[[1,1,'x'],[1,2,'b'],[1,3,'b'],[2,1,'b'],[2,2,'o'],[2,3,'b'],[3,1,'b'],[3,2,'b'],[3,3,'b']]","['mark',3,1]",1,"El movimiento parece aleatorio y sin una lógica estratégica, no contribuye a la mejora de la posición."
Razonamiento Estratégico,2,"[[1,1,'x'],[1,2,'b'],[1,3,'b'],[2,1,'b'],[2,2,'o'],[2,3,'b'],[3,1,'b'],[3,2,'b'],[3,3,'b']]","['mark',1,2]",1,"El movimiento bloquea una amenaza del oponente, aunque sin anticipar jugadas futuras o una estrategia más compleja."
Razonamiento Estratégico,3,"[[1,1,'x'],[1,2,'o'],[1,3,'b'],[2,1,'b'],[2,2,'x'],[2,3,'b'],[3,1,'b'],[3,2,'b'],[3,3,'b']]","['mark',2,3]",1,"Movimiento estratégico que anticipa la victoria y bloquea amenazas futuras, demostrando un razonamiento avanzado."
Factualidad,1,"[[1,1,'x'],[1,2,'b'],[1,3,'b'],[2,1,'b'],[2,2,'o'],[2,3,'b'],[3,1,'b'],[3,2,'b'],[3,3,'b']]","['mark',1,1]",1,"La explicación ignora que la casilla está ocupada y no se relaciona correctamente con el estado real del tablero."
Factualidad,2,"[[1,1,'x'],[1,2,'b'],[1,3,'b'],[2,1,'b'],[2,2,'o'],[2,3,'b'],[3,1,'b'],[3,2,'b'],[3,3,'b']]","['mark',3,2]",1,"Explicación generalmente correcta aunque sin señalar detalles importantes o implicaciones de la jugada."
Factualidad,3,"[[1,1,'x'],[1,2,'b'],[1,3,'b'],[2,1,'b'],[2,2,'o'],[2,3,'b'],[3,1,'b'],[3,2,'b'],[3,3,'b']]","['mark',2,2]",1,"Explicación precisa y fundamentada en hechos concretos del tablero, reflejando el verdadero estado del juego."
Coherencia Explicativa,1,"[[1,1,'x'],[1,2,'b'],[1,3,'b'],[2,1,'b'],[2,2,'o'],[2,3,'b'],[3,1,'b'],[3,2,'b'],[3,3,'b']]","['mark',1,3]",1,"Explicación confusa, sin relación clara con la jugada realizada ni con la situación del tablero."
Coherencia Explicativa,2,"[[1,1,'x'],[1,2,'b'],[1,3,'b'],[2,1,'b'],[2,2,'o'],[2,3,'b'],[3,1,'b'],[3,2,'b'],[3,3,'b']]","['mark',2,1]",1,"Explicación clara y entendible aunque con falta de profundidad o detalles adicionales."
Coherencia Explicativa,3,"[[1,1,'o'],[1,2,'x'],[1,3,'b'],[2,1,'b'],[2,2,'x'],[2,3,'b'],[3,1,'b'],[3,2,'b'],[3,3,'b']]","['mark',3,3]",1,"Explicación lógica, completa y coherente que justifica el movimiento y su impacto en el juego."
Claridad Lingüística,1,"[[1,1,'x'],[1,2,'b'],[1,3,'b'],[2,1,'b'],[2,2,'o'],[2,3,'b'],[3,1,'b'],[3,2,'b'],[3,3,'b']]","['mark',2,2]",1,"El texto presenta errores gramaticales y de redacción que dificultan la comprensión."
Claridad Lingüística,2,"[[1,1,'x'],[1,2,'b'],[1,3,'b'],[2,1,'b'],[2,2,'o'],[2,3,'b'],[3,1,'b'],[3,2,'b'],[3,3,'b']]","['mark',3,2]",1,"Lenguaje mayormente claro, aunque con algunos errores menores que no afectan el significado."
Claridad Lingüística,3,"[[1,1,'o'],[1,2,'x'],[1,3,'b'],[2,1,'b'],[2,2,'o'],[2,3,'b'],[3,1,'b'],[3,2,'b'],[3,3,'b']]","['mark',2,3]",1,"Lenguaje claro, preciso y gramaticalmente correcto que facilita la comprensión del razonamiento."
Adaptabilidad,1,"[[1,1,'x'],[1,2,'b'],[1,3,'b'],[2,1,'b'],[2,2,'o'],[2,3,'b'],[3,1,'b'],[3,2,'b'],[3,3,'b']]","['mark',1,2]",1,"No considera ni responde a los movimientos previos del oponente, mostrando falta de adaptación."
Adaptabilidad,2,"[[1,1,'x'],[1,2,'b'],[1,3,'b'],[2,1,'b'],[2,2,'o'],[2,3,'b'],[3,1,'b'],[3,2,'b'],[3,3,'b']]","['mark',2,2]",1,"Responde de forma básica a jugadas anteriores, pero sin ajustar su estrategia a largo plazo."
Adaptabilidad,3,"[[1,1,'o'],[1,2,'x'],[1,3,'b'],[2,1,'b'],[2,2,'o'],[2,3,'b'],[3,1,'b'],[3,2,'b'],[3,3,'b']]","['mark',3,3]",1,"Se adapta rápidamente a los cambios del oponente y modifica su estrategia para crear nuevas oportunidades."
